{
  "kind": "cineweave_codex_creative_brief",
  "contractVersion": "2.0.0",
  "worldId": "world.song-poetic-demo",
  "briefId": "brief.zero-prompt-song-character-01",
  "status": "ready",
  "inputMode": "zero_prompt",
  "purpose": "用户只知道想要清冷而温婉的宋韵女性角色；先在中性夹具内比较身份方向，不要求其书写五官术语或完整提示词。",
  "sourcePrompt": "新式宋韵，清冷但温婉，影视真人感，重点看眼神。",
  "task": {
    "type": "character_exploration",
    "output": "mixed",
    "medium": "live_action",
    "aspectRatio": "3:4"
  },
  "intent": {
    "character": "成年年轻女性，想要清冷克制但含蓄温婉的第一印象；具体骨相和识别锚点尚待探索。",
    "scene": "第一轮使用中性室内背景，避免场景或服装成为身份差异来源。",
    "performance": "平静直视，保持可比较的低强度表情。",
    "output": "输出可编辑的探索计划、候选方向和后续人类选择节点；不声称生成任何媒体。"
  },
  "styleSelection": {
    "medium": "live_action",
    "representation": "naturalistic",
    "styleAtoms": ["representation.live_action.naturalistic"],
    "temporalRequired": false,
    "historicalTreatment": "新式宋韵的诗意影视化"
  },
  "referenceBindings": [],
  "locks": {
    "hard": ["成年人物年龄感", "真人影视表现", "本轮只测试一个身份变量"],
    "soft": ["清冷与温婉的气质比例", "宋韵低饱和审美"],
    "free": ["非身份性的发丝和小型配饰", "背景低频材质"],
    "undefined": ["最终脸型", "稳定识别标记", "全身比例和动作指纹"]
  },
  "stagePlan": [
    {
      "stageId": "stage.character-explore",
      "owner": "cineweave-character",
      "status": "approved",
      "purpose": "将六项卡片和模糊感觉编译为共享测试夹具与候选身份假设。",
      "gate": "每个候选只变一个主变量，且不使用绝对美貌分数。",
      "outputContracts": ["cineweave_codex_character_exploration_brief", "cineweave_codex_character_option_set"]
    },
    {
      "stageId": "stage.candidate-board",
      "owner": "cineweave-production",
      "status": "pending",
      "purpose": "通过独立 Tile 和确定性拼装提供可比较候选板。",
      "gate": "每个候选提示词保留同一测试夹具，失败 Tile 单独重试。",
      "outputContracts": ["cineweave_codex_asset_recipe", "cineweave_codex_control_channel_set"]
    },
    {
      "stageId": "stage.character-converge",
      "owner": "cineweave-character",
      "status": "pending",
      "purpose": "记录用户选择、比较和局部偏好，决定新一轮探索或草案身份。",
      "gate": "用户明确选择后才能进入草案 CharacterSpec；仍需中性证据与人工锁定。",
      "outputContracts": ["cineweave_codex_character_preference_feedback"]
    }
  ],
  "missingHighImpact": [
    {
      "path": "experienceAxes.primaryExplorationAxis",
      "impact": "high",
      "reason": "同一候选板只能比较一个主变量。",
      "question": "第一轮更想比较面部轮廓、眼神、身形还是姿态？",
      "safeDefault": "先比较面部轮廓"
    }
  ],
  "assumptions": [
    "未提供参考图，因此不建立或推断现实人物肖像身份。",
    "未要求视频，暂不需要时间性风格或运镜参考。"
  ],
  "validation": {
    "intentParsed": true,
    "referencesRoleScoped": true,
    "questionsPrioritized": true,
    "styleDoesNotOwnIdentity": true,
    "noProviderClaim": true
  },
  "skillReceipt": {
    "repository": "https://github.com/Wilder1222/cineweave-studio",
    "ref": "v2.0.0",
    "commit": "0123456789abcdef0123456789abcdef01234567",
    "contentHash": "sha256:eeeeeeeeeeeeeeeeeeeeeeeeeeeeeeeeeeeeeeeeeeeeeeeeeeeeeeeeeeeeeeee",
    "installedBy": "codex-environment",
    "usedAt": "2026-08-20T18:00:00.000Z"
  }
}
